bases/drone/papers/arxiv-2103.13933-unmanned-aerial-vehicle-visual-detection/docling_tables.json

{
 "docling": "2.130.0",
 "ocr": false,
 "tables": [
  {
   "page": 7,
   "bbox": [
    98.7,
    93.1,
    496.4,
    290.8
   ],
   "caption": "Table 1: Detection Performance Benchmark",
   "rows": [
    [
     "Dataset",
     "Model",
     "",
     "",
     "APAP0.5AP0.75APSAPMAPLARARSARMARL",
     "",
     "",
     "",
     "",
     "",
     "",
     ""
    ],
    [
     "MAV-VID",
     "FasterRCNN",
     "0.592",
     "0.978",
     "0.672",
     "0.154",
     "0.541",
     "0.656",
     "0.659",
     "0.369",
     "0.621",
     "0.721"
    ],
    [
     "MAV-VID",
     "SSD512",
     "0.535",
     "0.967",
     "0.536",
     "0.083",
     "0.499",
     "0.587",
     "0.612",
     "0.377",
     "0.578",
     "0.666"
    ],
    [
     "MAV-VID",
     "YOLOv3",
     "0.537",
     "0.963",
     "0.542",
     "0.066",
     "0.471",
     "0.636",
     "0.612",
     "0.208",
     "0.559",
     "0.696"
    ],
    [
     "MAV-VID",
     "DETR",
     "0.545",
     "0.971",
     "0.560",
     "0.044",
     "0.490",
     "0.612",
     "0.692",
     "0.346",
     "0.661",
     "0.742"
    ],
    [
     "Drone-vs-Bird",
     "FasterRCNN",
     "0.283",
     "0.632",
     "0.197",
     "0.218",
     "0.473",
     "0.506",
     "0.356",
     "0.298",
     "0.546",
     "0.512"
    ],
    [
     "Drone-vs-Bird",
     "SSD512",
     "0.250",
     "0.629",
     "0.134",
     "0.199",
     "0.422",
     "0.052",
     "0.379",
     "0.327",
     "0.549",
     "0.556"
    ],
    [
     "Drone-vs-Bird",
     "YOLOv3",
     "0.210",
     "0.546",
     "0.105",
     "0.158",
     "0.395",
     "0.356",
     "0.302",
     "0.238",
     "0.512",
     "0.637"
    ],
    [
     "Drone-vs-Bird",
     "DETR",
     "0.251",
     "0.667",
     "0.123",
     "0.190",
     "0.444",
     "0.533",
     "0.473",
     "0.425",
     "0.631",
     "0.550"
    ],
    [
     "Anti-UAV Full",
     "FasterRCNN",
     "0.612",
     "0.974",
     "0.701",
     "0.517",
     "0.619",
     "0.737",
     "0.666",
     "0.601",
     "0.670",
     "0.778"
    ],
    [
     "Anti-UAV Full",
     "SSD512",
     "0.613",
     "0.982",
     "0.697",
     "0.527",
     "0.619",
     "0.712",
     "0.678",
     "0.616",
     "0.682",
     "0.780"
    ],
    [
     "Anti-UAV Full",
     "YOLOv3",
     "0.604",
     "0.977",
     "0.676",
     "0.529",
     "0.619",
     "0.708",
     "0.667",
     "0.618",
     "0.668",
     "0.760"
    ],
    [
     "Anti-UAV Full",
     "DETR",
     "0.586",
     "0.977",
     "0.648",
     "0.509",
     "0.589",
     "0.692",
     "0.649",
     "0.598",
     "0.649",
     "0.752"
    ],
    [
     "Anti-UAV RGB",
     "FasterRCNN",
     "0.642",
     "0.982",
     "0.770",
     "0.134",
     "0.615",
     "0.718",
     "0.694",
     "0.135",
     "0.677",
     "0.760"
    ],
    [
     "Anti-UAV RGB",
     "SSD512",
     "0.627",
     "0.979",
     "0.747",
     "0.124",
     "0.593",
     "0.718",
     "0.703",
     "0.156",
     "0.682",
     "0.785"
    ],
    [
     "Anti-UAV RGB",
     "YOLOv3",
     "0.617",
     "0.986",
     "0.717",
     "0.143",
     "0.595",
     "0.702",
     "0.684",
     "0.181",
     "0.664",
     "0.758"
    ],
    [
     "Anti-UAV RGB",
     "DETR",
     "0.628",
     "0.978",
     "0.740",
     "0.129",
     "0.590",
     "0.734",
     "0.700",
     "0.144",
     "0.675",
     "0.794"
    ],
    [
     "Anti-UAV IR",
     "FasterRCNN",
     "0.581",
     "0.977",
     "0.641",
     "0.523",
     "0.623",
     "-",
     "0.636",
     "0.602",
     "0.663",
     "-"
    ],
    [
     "Anti-UAV IR",
     "SSD512",
     "0.590",
     "0.975",
     "0.639",
     "0.518",
     "0.636",
     "-",
     "0.649",
     "0.609",
     "0.681",
     "-"
    ],
    [
     "Anti-UAV IR",
     "YOLOv3",
     "0.591",
     "0.976",
     "0.643",
     "0.533",
     "0.638",
     "-",
     "0.651",
     "0.620",
     "0.675",
     "-"
    ],
    [
     "Anti-UAV IR",
     "DETR",
     "0.599",
     "0.980",
     "0.655",
     "0.525",
     "0.642",
     "-",
     "0.671",
     "0.633",
     "0.701",
     "-"
    ]
   ]
  },
  {
   "page": 7,
   "bbox": [
    70.8,
    443.9,
    265.3,
    506.9
   ],
   "caption": "Table 2: Detection inference time",
   "rows": [
    [
     "Model",
     "GFLOPSFPSParams",
     "",
     ""
    ],
    [
     "FasterRCNN",
     "207",
     "18.0",
     "41M"
    ],
    [
     "SSD512",
     "88",
     "32.4",
     "24M"
    ],
    [
     "YOLOv3",
     "70",
     "36.0",
     "61M"
    ],
    [
     "DETR",
     "86",
     "21.4",
     "41M"
    ]
   ]
  },
  {
   "page": 8,
   "bbox": [
    100.7,
    93.1,
    496.2,
    175.2
   ],
   "caption": "Table 3: Cross modality detection performance",
   "rows": [
    [
     "Dataset",
     "Model",
     "AP",
     "AP0.5",
     "AP0.75",
     "APS",
     "APM",
     "APL",
     "AR",
     "ARS",
     "ARM",
     "ARL"
    ],
    [
     "Anti-UAV RGB",
     "IRFasterRCNN",
     "0.394",
     "0.828",
     "0.322",
     "0.000",
     "0.372",
     "0.481",
     "0.484",
     "0.000",
     "0.453",
     "0.598"
    ],
    [
     "Anti-UAV RGB",
     "IR SSD512",
     "0.161",
     "0.342",
     "0.124",
     "0.000",
     "0.126",
     "0.291",
     "0.204",
     "0.016",
     "0.165",
     "0.341"
    ],
    [
     "Anti-UAV RGB",
     "IR YOLOv3",
     "0.113",
     "0.299",
     "0.061",
     "0.002",
     "0.082",
     "0.240",
     "0.156",
     "0.019",
     "0.119",
     "0.286"
    ],
    [
     "Anti-UAV RGB",
     "IR DETR",
     "0.284",
     "0.728",
     "0.148",
     "0.000",
     "0.241",
     "0.409",
     "0.390",
     "0.000",
     "0.354",
     "0.519"
    ],
    [
     "Anti-UAV IR",
     "RGBFasterRCNN",
     "0.321",
     "0.644",
     "0.281",
     "0.241",
     "0.371",
     "-",
     "0.488",
     "0.453",
     "0.515",
     "-"
    ],
    [
     "Anti-UAV IR",
     "RGB SSD512",
     "0.169",
     "0.452",
     "0.098",
     "0.133",
     "0.213",
     "-",
     "0.344",
     "0.312",
     "0.370",
     "-"
    ],
    [
     "Anti-UAV IR",
     "RGB YOLOv3",
     "0.215",
     "0.475",
     "0.164",
     "0.138",
     "0.303",
     "-",
     "0.303",
     "0.228",
     "0.363",
     "-"
    ],
    [
     "Anti-UAV IR",
     "RGBDETR",
     "0.149",
     "0.333",
     "0.109",
     "0.125",
     "0.170",
     "-",
     "0.216",
     "0.190",
     "0.236",
     "-"
    ]
   ]
  },
  {
   "page": 8,
   "bbox": [
    98.6,
    208.3,
    496.0,
    452.3
   ],
   "caption": "Table 4: Object Tracking Performance Benchmark",
   "rows": [
    [
     "Dataset.",
     "Model.",
     "MOTA ↑.SORT / DeepSORT / Tracktor",
     "IDF1 ↑.SORT / DeepSORT / Tracktor",
     "IDSw. ↓.SORT / DeepSORT / Tracktor"
    ],
    [
     "MAV-VID",
     "FasterRCNN SSD512 YOLOv3",
     "0.952/0.951/0.955 0.865/0.851/0.888",
     "0.547/0.591/0.680 0.402/0.430/0.944",
     "54 / 69 / 15 283 / 435 / 35 269 / 309 / 26"
    ],
    [
     "MAV-VID",
     "",
     "0.881/0.877/0.934",
     "0.260/0.419/0.970",
     ""
    ],
    [
     "MAV-VID",
     "DETR",
     "0.943/0.944/0.947",
     "0.600/0.603/0.975",
     "61 / 50 / 16"
    ],
    [
     "Drone-vs-Bird",
     "FasterRCNN",
     "0.420/0.415/0.459",
     "0.377/0.391/0.439",
     "35183/35854/21952"
    ],
    [
     "Drone-vs-Bird",
     "SSD512",
     "0.364/0.328/0.525",
     "0.304/0.335/0.872",
     "35421/39532/16517"
    ],
    [
     "Drone-vs-Bird",
     "YOLOv3",
     "0.400/0.370/0.523",
     "0.287/0.359/0.868",
     "38451/41887/19623"
    ],
    [
     "Drone-vs-Bird",
     "DETR",
     "0.012/0.090/0.130",
     "0.020/0.303/0.377",
     "29126/29407/15316"
    ],
    [
     "Anti-UAV Full",
     "FasterRCNN",
     "0.878/0.835/0.950",
     "0.445/0.478/0.790",
     "2620 / 4094 / 179"
    ],
    [
     "Anti-UAV Full",
     "SSD512",
     "0.856/0.806/0.936",
     "0.373/0.406/0.966",
     "2831 / 4509 / 93"
    ],
    [
     "Anti-UAV Full",
     "YOLOv3",
     "0.767/0.693/0.959",
     "0.193/0.292/0.979",
     "3582 / 6097 / 98"
    ],
    [
     "Anti-UAV Full",
     "DETR",
     "0.749/0.708/0.830",
     "0.405/0.451/0.920",
     "2814 / 4214 / 40"
    ],
    [
     "Anti-UAV RGB",
     "FasterRCNN",
     "0.791/0.717/0.912",
     "0.295/0.290/0.702",
     "2042 / 3163 / 163"
    ],
    [
     "Anti-UAV RGB",
     "SSD512",
     "0.771/0.696/0.900",
     "0.271/0.306/0.946",
     "2096 / 3239 / 126"
    ],
    [
     "Anti-UAV RGB",
     "YOLOv3",
     "0.714/0.633/0.897",
     "0.150/0.227/0.948",
     "2390 / 3617 / 87"
    ],
    [
     "Anti-UAV RGB",
     "DETR",
     "0.803/0.753/0.940",
     "0.323/0.327/0.969",
     "2101 / 2857 / 19"
    ],
    [
     "Anti-UAV IR",
     "FasterRCNN",
     "0.954/0.919/0.987",
     "0.528/0.571/0.873",
     "560 / 1154 // 22"
    ],
    [
     "Anti-UAV IR",
     "SSD512",
     "0.922/0.904/0.963",
     "0.442/0.454/0.981",
     "716 / 1020 / 20"
    ],
    [
     "Anti-UAV IR",
     "YOLOv3",
     "0.780/0.718/0.985",
     "0.180/0.327/0.992",
     "1216 / 2259 / 10"
    ],
    [
     "Anti-UAV IR",
     "DETR",
     "0.951/0.930/0.984",
     "0.552/0.628/0.991",
     "575 / 927 / 20"
    ]
   ]
  }
 ]
}

bases/drone/papers/arxiv-2103.13933-unmanned-aerial-vehicle-visual-detection/fulltext.md

## Abstract

Unmanned Aerial Vehicles (UAV) can pose a major risk for aviation safety, due to both negligent and malicious use. For this reason, the automated detection and tracking of UAV is a fundamental task in aerial security systems. Common technologies for UAV detection include visibleband and thermal infrared imaging, radio frequency and radar. Recent advances in deep neural networks (DNNs) for image-based object detection open the possibility to use visual information for this detection and tracking task. Furthermore, these detection architectures can be implemented as backbones for visual tracking systems, thereby enabling persistent tracking of UAV incursions. To date, no comprehensive performance benchmark exists that applies DNNs to visible-band imagery for UAV detection and tracking. To this end, three datasets with varied environmental conditions for UAV detection and tracking, comprising a total of 241 videos (331,486 images), are assessed using four detection architectures and three tracking frameworks. The best performing detector architecture obtains an mAP of 98.6% and the best performing tracking framework obtains a MOTA of 98.7%. Cross-modality evaluation is carried out between visible and infrared spectrums, achieving a maximal 82.8% mAP on visible images when training in the infrared modality. These results provide the first public multi-approach benchmark for state-of-the-art deep learning-based methods and give insight into which detection and tracking architectures are effective in the UAV domain.

## 1. Introduction

-state-of-the-art detection performance (0.986 mAP) is achieved for visual detection and tracking within the counter-UAV domain, compared to previous leading performance (0.952 mAP [18]) .

-novel evaluation of cross-modality training and testing for UAV. Training on IR data is demonstrated to be sufficient for inference on RGB imagery (0.828 mAP).

### 4.1. Detection

Comparative UAV detection performance among the datasets and detectors is shown in Table 1. It can be observed that detection performance varies significantly across the datasets with the best performance achieved in the Anti-UAV RGB dataset (0.986 mAP). This dataset has the most uniform set of image sequences since all videos are recorded in similar settings, with only 6 types of UAV present within it. The mAP across both modalities in the Anti-UAV dataset remains similar (mAP ranges from 0.978 to 0.986 for RGB and from 0.975 to 0.980 for IR), implying that the detectors are learning to capture the shape rather than the colour information. This is further supported by the cross-modality experiments, discussed later. However, the IR dataset obtains a dramatic increase of the AP for small objects (maximal AP S : 0.533 via YOLOv3). This can be explained by the higher contrast for images captured with harsh weather conditions or poor lighting. Detection performance for the MAV-VID dataset is similar to Anti-UAV (0.978 mAP with Faster RCNN). Although MAV-VID dataset comprises bigger and clearer UAV images, it has less input data than the other two datasets. Additionally, the low precision for small objects can be explained by the low number of visually small UAV in the training set. This reveals the need of annotated datasets with UAV at a long distance. Finally, the Drone-vs-Bird dataset obtains a maximal mAP of 0.667 via DETR and COCO AP of 0.283 via Faster RCNN. This indicates that Faster RCNN is better at predicting tighter bounding boxes. The relatively poorer performance in the Drone-vs-Bird dataset can be attributed to the significantly smaller size of the UAVs (Figure 1).

Faster RCNN and DETR generally outperform the onestage detectors. However, it is important to note that both Faster RCNN and DETR have a minimum image height of 800 pixels which allows for a better performance at detecting small UAV. On the other hand, the inference time for SSD512 and YOLOv3 models are faster with 32.4 and 36.0 fps, as seen in Table 2. Although YOLOv3 is the fastest architecture, SSD512 is the lightest model with only 24M parameters (∼192 MB). As a result, in settings where memory and computational power is a constraint (such as an embedded system), lightweight networks such as SSD or YOLOv3 may be preferred.

Lastly, we evaluate the detector performance on RGB and IR modalities when testing on a different modality to the one that the network was trained on (Table 3). The results show that features learned in the IR domain can be used as a good approximation for detecting drones in the visual spectrum (0.828 mAP with Faster RCNN). This may indicate that the network is learning to represent a UAV based on its shape and not in its colour or texture. On the other hand, the Anti-UAV IR mAP dropped to 0.644 with Faster RCNN trained on the Anti-UAV RGB. This bigger may be caused by the loss of the colour information in IR imagery. One-stage detectors performed poorer, indicating the difficulty of getting the proper features on each grid cell defined by these architectures.

## 5. Conclusion

Computer vision for UAV is an exciting but underdeveloped research field, relative to the necessity of aviation safety and the potential threat (advertent or inadvertent) that UAV carry. To accelerate research in this field, we have conducted a benchmark study on UAV detection and tracking. We have performed an exhaustive evaluation over wellestablished generic object detectors on three UAV datasets. To the best of our knowledge, we are the first to evaluate a comprehensive array of datasets, across environments, and conditions, captured by both ground and UAV-mounted cameras, optical and IR cameras, at near and far viewpoints. As such, we are able to show that common neural network architectures are capable of detecting small, fast moving objects. Furthermore, YOLOv3 overall yields the best precision (as high as 0.986 mAP), but Faster RCNN is best suited towards detecting small UAV, for which category it consistently achieves the highest mAP (up to 0.770). This is a critical observation when we consider that detecting UAV early is often a stronger priority than detecting precisely.

We also show that cross-modality detection is possible for optical and infrared images, wherein training on IR imagery for inference upon visible band spectrum data is not only sufficient but yields excellent performance (0.828 mAP). Furthermore, our tracking results corroborate the suitability towards employing DETR within counter-UAV systems; DETR is best suited for a detection backbone to tracking systems for small objects, and performs adequately upon cross-modal videos. We further demonstrate that the Tracktor framework is best able to track UAV (MOTA: 0.987).